{"budget":{"calls_made":4,"max_verifier_calls":4},"calls":[{"call_index":0,"candidate_key":"candidate-sha256:6e7ef2ce69818d067e35768b33c291f726bd153dfeba13532b3ef41b123e80fc","proposal_id":"proposal-sha256:594170376191ee2ac6da7c62a9815427ab2c516b141daf1648b473b5b67e6a9a","result_id":"result-sha256:9a912a4257213215f61a9097f632bf1da4cebfe1826c38051c16c79d8f92f0f7","score_float_hex":null},{"call_index":1,"candidate_key":"candidate-sha256:bf0384dcab38b5a56f50ffdbb31572946614a14d8d05f4e976b8d02618be2c40","proposal_id":"proposal-sha256:bec3d1997a68cad9be9be544ff0552ec131b539b3f3de3b9d9ed59ec39e8923a","result_id":"result-sha256:9363855f1aef4eaa7dc59e93f59aed38df45a934339ca1bbb401b3911a47262d","score_float_hex":null},{"call_index":2,"candidate_key":"candidate-sha256:23e82384d617e1fd1fa2c4b90fb9974e9f51dc88c9762da2ae740a8327666859","proposal_id":"proposal-sha256:72ed3ece9eda91079b457c53cb160bb38aca6ad73e2e1db1dde241be2875ddcd","result_id":"result-sha256:5797de2ef06aa39f396b189ed2673786f72fe3ad5ba573d9972ff4ae16ce1a09","score_float_hex":null},{"call_index":3,"candidate_key":"candidate-sha256:b9324399b721f86e1d549e9ab35e4a24526605d1332e373078a3e76f92eedf23","proposal_id":"proposal-sha256:be5d6c6470632a3eafb5728d7ec85f2d1548a68aadb1468a31c3c666d5b21f8c","result_id":"result-sha256:c8565a1b0d8fa98a382d741044016677d6dfa577d55872f1c8ecba3ab4330739","score_float_hex":null}],"policy":{"candidate_order_sha256":"a434e30228c9043efda76618c24ebd425965a2473b7e5963b886a14084b4e6f1","checkpoint_sha256":null,"policy_id":"input_order_v0","random_seed":0,"version":"0.1.0"},"pool_id":"pool-sha256:4b71fafa31508ddcb71b542788459e700bbb524b3854ac280a823f21aac48004","run_id":"run-sha256:97aec7673ee80139429db45ec5a283f7b1bfd22dc8fc5bcfe9cfa4c06ecbe50d","schema_version":"partizan.discovery_run.v0.1","summary":{"budget_exhausted":true,"calls_made":4,"first_target_call_index":0,"outcome_counts":{"certified_other":1,"certified_target":1,"error":1,"rejected":1},"unique_candidates_verified":4,"unique_certified_targets":1},"target_id":"target-sha256:c22a73801f2e855ec21de33b9e10c3023683b196bdcc05566eb8bf4a4feb9fe8"}
